"soc_code","pct_tasks_automation","pct_tasks_augmentation","diff_extensive","mean_automation","mean_augmentation","diff_intensive","occupation","soc_codetrue","two_digit_soc_code","total_employment","median_wage","educationcode","degfield_1","degree_share_1","degfield_2","degree_share_2","degfield_3","degree_share_3","related_soc_code_1","relatedness_score_1","related_soc_code_2","relatedness_score_2","related_soc_code_3","relatedness_score_3","ranking","alt_titles"
"11-1011",".0789474",".1622807","-.0833333","3.596589","15.22694","-11.63035","Chief Executives","11-1011","Management","211850","206420","Bachelors degree","business",".3605354","engineering",".1117319","social sciences",".1019854","13-1111","2.340312","11-1021","2.096216","13-1082","2.025255","40","Chief Diversity Officer (CDO) | Chief Executive Officer (CEO) | Chief Financial Officer (CFO) | Chief Nursing Officer | Chief Operating Officer (COO) | Executive Director | Executive Vice President (EVP) | Operations Vice President | President | Vice President"
"11-1021",".1111111",".1111111","0","6.014692","5.096418",".9182739","General and Operations Managers","11-1021","Management","3584420","102950","Bachelors degree","business",".3514659","engineering",".0930254","social sciences",".085134","11-3012","2.560973","43-1011","2.524709","49-1011","2.491302","33","Business Manager | Facilities Manager | Facility Manager | General Manager (GM) | Operations Director | Operations Manager | Plant Manager | Plant Superintendent | Production Manager | Store Manager"
"11-2011",".2113971",".2113971","0","11.18704","15.47963","-4.292589","Advertising and Promotions Managers","11-2011","Management","21100","126960","Bachelors degree","communications",".2658755","business",".2601325","fine arts",".0961442","41-3011","3.028975","11-2021","2.855332","13-1161","2.559391","22","Account Executive | Advertising Director | Advertising Manager | Advertising Sales Manager | Classified Advertising Manager | Marketing Director | Marketing Manager | Marketing and Promotions Manager | Promotions Director | Retail Advertising Sales Manager"
"11-2021",".4166667",".3333333",".0833333","22.46714","22.9874","-.5202618","Marketing Managers","11-2021","Management","384980","161030","Bachelors degree","business",".3461399","communications",".1735326","social sciences",".078884","11-2022","2.87397","11-2011","2.855332","13-1161","2.829391","9","Account Supervisor | Brand Manager | Business Development Director | Business Development Manager | Commercial Lines Manager | Market Development Executive | Marketing Coordinator | Marketing Director | Marketing Manager | Product Manager"
"11-2022",".125",".125","0","6.428572","6.071428",".3571434","Sales Managers","11-2022","Management","603710","138060","Bachelors degree","business",".4150134","social sciences",".0866448","engineering",".0762398","11-2021","2.87397","41-3091","2.765537","11-2011","2.382879","31","Director of Sales | District Sales Manager | General Manager | Regional Sales Manager | Sales Manager | Sales Representative | Sales Supervisor | Sales and Marketing Vice President | Store Manager | Vice President of Sales"
"11-2030",".3076923",".3846154","-.0769231","15.0206","26.64607","-11.62547","Public Relations and Fundraising Managers","11-2031","Management","112980","131000","Bachelors degree","communications",".2823907","business",".1506895","social sciences",".1150634","27-3031","2.836147","13-1131","2.73228","11-2011","2.236942","14",""
"11-3012","0","0","0","0","0","0","Administrative Services Managers","11-3011","Management","254140","108390","Bachelors degree","business",".3387345","social sciences",".0906005","psychology",".059999","13-1111","2.84692","43-1011","2.763704","43-6014","2.623171","100",""
"11-3021",".2352941",".2352941","0","9.762148","13.76726","-4.005116","Computer and Information Systems Managers","11-3021","Management","645970","171200","Bachelors degree","business",".2282495","computer and information sciences",".2244622","engineering",".1547288","15-1252","3.104928","13-1082","2.913048","13-1111","2.617476","19","Computing Services Director | Data Processing Manager | Director of Application Development | Information Systems Director (IS Director) | Information Systems Manager (IS Manager) | Information Systems Supervisor (IS Supervisor) | Information Technology Director (IT Director) | Information Technology Manager (IT Manager) | MIS Director (Management Information Systems Director) | Technical Services Manager"
"11-3031",".09375",".09375","0","4.343014","6.371272","-2.028257","Financial Managers","11-3031","Management","818620","161700","Bachelors degree","business",".5664122","social sciences",".0986724","engineering",".0371566","13-2052","2.325541","13-2051","2.32355","13-2011","2.304846","36",""
"11-3051",".010989","0",".010989","1.098901","0","1.098901","Industrial Production Managers","11-3051","Management","234380","121440","Bachelors degree","business",".24408","engineering",".2319077","biology and life sciences",".0730725","51-8090","2.125811","51-8031","2.094971","11-9041","2.040524","53","Area Plant Manager | General Production Manager | Manufacturing Coordinator | Manufacturing Manager | Plant Manager | Plant Senior Manager | Product Line Manager | Production Control Manager | Production Manager | Sub Plant Manager"
"11-3061",".3333333",".2",".1333333","25.67011","7.663223","18.00689","Purchasing Managers","11-3061","Management","81240","139510","Bachelors degree","business",".435302","social sciences",".0944886","engineering",".0734002","43-3061","2.876519","11-2022","2.241138","11-3071","2.151583","13","Commodity Manager | Director of Materials | Director of Purchasing | Director of Strategic Sourcing | Materials Manager | Procurement Manager | Procurement Officer | Purchasing Director | Purchasing Manager | Purchasing Supervisor"
"11-3071",".0585317",".0585317","0","3.190182","3.111294",".0788881","Transportation, Storage, and Distribution Managers","11-3071","Management","213000","102010","HS diploma or equivalent","business",".4150054","engineering",".0874681","social sciences",".0765259","13-1081","2.777975","11-1021","2.198447","11-3061","2.151583","46",""
"11-3111","0","0","0","0","0","0","Compensation and Benefits Managers","11-3111","Management","20070","140360","Bachelors degree","business",".4438528","social sciences",".0924319","psychology",".0868083","13-1141","3.36623","43-4161","2.378946","43-4061","2.301352","100","Benefits Coordinator | Benefits Manager | Business Manager | Compensation Director | Compensation Manager | Compensation and Benefits Manager | Corporate Controller | Director of Compensation | Human Resources Director | Office Manager"
"11-3121","0","0","0","0","0","0","Human Resources Managers","11-3121","Management","215520","140030","Bachelors degree","business",".4265913","psychology",".0918469","social sciences",".0819352","43-4161","2.900426","13-1111","2.516853","11-3131","2.406579","100","Director of Human Resources | Employee Benefits Manager | Employee Relations Manager | Human Resources Director (HR Director) | Human Resources Manager (HR Manager) | Human Resources Vice President"
"11-3131",".3",".4","-.1","14.70958","25.29042","-10.58084","Training and Development Managers","11-3131","Management","44960","127090","Bachelors degree","business",".2363124","education administration and teaching",".1019936","social sciences",".0938053","13-1151","3.767212","13-1111","2.724947","11-9151","2.422423","14","Development Manager | Director of Education | Director of Educational Services | Director of Staff Development | Education and Development Manager | Learning Manager | Manager of Staff Training and Development | Training Director | Training Manager | Training and Development Coordinator"
"11-9013",".0536062",".0721248","-.0185185","2.293538","5.331735","-3.038197","Farmers, Ranchers, and Other Agricultural Managers","11-9013","Management","5910","87980","HS diploma or equivalent","agriculture",".3398491","business",".1490693","education administration and teaching",".0928909","17-2021","2.215314","45-2099","2.209004","45-1011","2.096187","46",""
"11-9021",".1764706",".1176471",".0588235","13.78205","9.294872","4.48718","Construction Managers","11-9021","Management","348330","106980","Bachelors degree","engineering",".2437424","business",".2221359","construction services",".1118304","47-1011","2.630359","17-1011","2.461152","13-1082","2.447122","25","Concrete Foreman | Construction Area Manager | Construction Foreman | Construction Manager | Construction Superintendent | General Contractor | Job Superintendent | Project Executive | Project Manager | Project Superintendent"
"11-9030",".0434783",".0434783","0","1.874728","2.473098","-.5983701","Education Administrators, All Other","11-9039","Management","621000","96500","Bachelors degree","education administration and teaching",".3084643","business",".122535","social sciences",".0731258","11-9030","2.456227","11-3131","2.350527","11-9151","2.206576","50",""
"11-9030",".125",".125","0","7.183099","6.150235","1.032864","Education and Childcare Administrators, Preschool and Daycare","11-9031","Management","621000","96500","Bachelors degree","education administration and teaching",".3084643","business",".122535","social sciences",".0731258","11-9030","2.456227","11-3131","2.350527","11-9151","2.206576","31",""
"11-9030",".2",".2","0","9.251105","10.7489","-1.49779","Education Administrators, Postsecondary","11-9033","Management","621000","96500","Bachelors degree","education administration and teaching",".3084643","business",".122535","social sciences",".0731258","11-9030","2.456227","11-3131","2.350527","11-9151","2.206576","23",""
"11-9030",".1785714",".1785714","0","10.71225","12.36467","-1.652424","Education Administrators, Kindergarten through Secondary","11-9032","Management","621000","96500","Bachelors degree","education administration and teaching",".3084643","business",".122535","social sciences",".0731258","11-9030","2.456227","11-3131","2.350527","11-9151","2.206576","25",""
"11-9041",".0833333",".125","-.0416667","3.308632","10.32773","-7.0191","Architectural and Engineering Managers","11-9041","Management","210340","167740","Bachelors degree","engineering",".6289524","computer and information sciences",".0928231","business",".0697142","17-2041","2.170526","17-2131","2.121932","13-1082","2.079825","39","Chief Engineer | Civil Engineering Manager | Director of Engineering | Engineering Group Manager | Engineering Manager | Engineering Program Manager | Principal Engineer | Project Engineer | Project Engineering Manager | Project Manager"
"11-9051","0","0","0","0","0","0","Food Service Managers","11-9051","Management","244230","65310","HS diploma or equivalent","business",".3555342","social sciences",".0754241","education administration and teaching",".0552616","35-1011","2.266046","35-1012","2.225516","35-2021","2.08309","100","Banquet Manager | Catering Manager | Director of Food and Beverage | Food Service Director | Food Service Manager | Food Service Supervisor | Food and Beverage Manager | Kitchen Manager | Restaurant General Manager | Restaurant Manager"
"11-9070","0","0","0","0","0","0","Gambling Managers","11-9071","Management","41320","81380","HS diploma or equivalent","business",".2630565","physical fitness, parks, recreation, and leisure",".0969916","education administration and teaching",".0915764","39-9032","1.120682","11-9081","1.093195","11-1021",".9597456","100",""
"11-9081",".0952381",".0952381","0","5.272174","4.727826",".5443478","Lodging Managers","11-9081","Management","41350","68130","HS diploma or equivalent","business",".3850364","social sciences",".0738344","education administration and teaching",".0662086","43-4081","2.365259","11-9051","1.689966","11-9141","1.687806","36","Bed and Breakfast Innkeeper | Director of Front Office | Front Desk Manager | Front Office Manager | Hotel Manager | Night Manager | Resort Manager | Rooms Director"
"11-9111",".1875",".125",".0625","15.46387","5.964697","9.499176","Medical and Health Services Managers","11-9111","Management","565840","117960","Bachelors degree","medical and health sciences and services",".3278834","business",".1433609","psychology",".0904604","11-9151","2.563584","13-1111","2.45228","21-1015","2.354522","23","Clinical Director | Director of Nursing | Health and Social Service Manager | Medical Records Manager | Mental Health Program Manager | Nurse Manager | Nutrition Services Manager | Office Manager | Practice Administrator | Program Manager"
"11-9121",".0764411",".0764411","2.48e-09","4.636381","5.451339","-.8149582","Natural Sciences Managers","11-9121","Management","100870","161180","Bachelors degree","biology and life sciences",".2595527","medical and health sciences and services",".1027966","psychology",".0898794","13-1082","1.975992","13-1111","1.799897","17-2081","1.684449","41","Environmental Program Manager | Fisheries Director | Health Sciences Manager | Laboratory Manager | Natural Science Manager | Research Manager | Research and Development Director | Senior Investigator | Senior Scientist | Water Team Leader"
"11-9141",".2222222",".0555556",".1666667","23.71585","2.95082","20.76503","Property, Real Estate, and Community Association Managers","11-9141","Management","296640","66700","HS diploma or equivalent","business",".3507704","social sciences",".0998768","communications",".0565788","41-9020","2.564148","11-1021","1.80911","11-3012","1.76483","21","Apartment Manager | Commercial Property Services Coordinator | Community Manager | Condominium Association Property Manager | Consulting Property Manager | Lease Administration Supervisor | Leasing Manager | On Site Property Manager | Property Manager | Resident Manager"
"11-9151",".1428571",".0714286",".0714286","11.46589","3.918723","7.54717","Social and Community Service Managers","11-9151","Management","195490","78240","Bachelors degree","social sciences",".1412825","business",".1391704","psychology",".114535","21-1021","2.792091","21-1015","2.764503","11-9111","2.563584","29","Adoption Services Manager | Children's Service Supervisor | Clinical Services Director | Community Services Block Grant/Outreach Social Worker (CSBG/Outreach Social Worker) | Director of Child Welfare Services | Director of Social Services | Program Director | Program Manager | Social Services Director | Vocational Rehabilitation Administrator"
"11-9161","0","0","0","0","0","0","Emergency Management Directors","11-9161","Management","12570","86130","Bachelors degree","business",".1975201","criminal justice and fire protection",".164271","social sciences",".1099352","43-5031","2.302424","29-2042","2.03226","11-9111","1.987134","100","Emergency Management Consultant | Emergency Management Coordinator | Emergency Management Director | Emergency Management Program Specialist | Emergency Management System Director (EMS Director) | Emergency Planner | Emergency Preparedness Coordinator | Emergency Preparedness Program Specialist | Emergency Preparedness Specialist | Emergency Services Director"
"11-9199",".05",".05","0","3.676471","2.205882","1.470588","Funeral Service Managers","11-9061","Management","668400","84780","HS diploma or equivalent","business",".2866628","engineering",".1156943","social sciences",".0903422","13-1111","1.425397","11-9111","1.385487","11-9151","1.31159","48","Arranging Funeral Director | Assistant Manager of Operations | Computerized Forwarding System Supervisor | Distribution Operation Supervisor (SDO) | Distribution Operations Manager | Funeral Home Location Manager | Funeral Home Manager | Funeral Service Manager | Location Manager | Mail Delivery Supervisor | Market Manager | Mortuary Operations Manager | Postal Supervisor | Postmaster | Postmaster Relief (PMR) | Remote Encoding Center Manager | Remote Encoding Operations Supervisor | Sales Manager, Prearranged Funerals | Scheduling Manager"
"11-9199","0","0","0","0","0","0","Postmasters and Mail Superintendents","11-9131","Management","668400","84780","HS diploma or equivalent","business",".2866628","engineering",".1156943","social sciences",".0903422","13-1111","1.425397","11-9111","1.385487","11-9151","1.31159","100","Arranging Funeral Director | Assistant Manager of Operations | Computerized Forwarding System Supervisor | Distribution Operation Supervisor (SDO) | Distribution Operations Manager | Funeral Home Location Manager | Funeral Home Manager | Funeral Service Manager | Location Manager | Mail Delivery Supervisor | Market Manager | Mortuary Operations Manager | Postal Supervisor | Postmaster | Postmaster Relief (PMR) | Remote Encoding Center Manager | Remote Encoding Operations Supervisor | Sales Manager, Prearranged Funerals | Scheduling Manager"
"11-9199",".0904248",".0982951","-.0078704","4.731984","5.998155","-1.266171","Managers, All Other","11-9199","Management","668400","84780","HS diploma or equivalent","business",".2866628","engineering",".1156943","social sciences",".0903422","13-1111","1.425397","11-9111","1.385487","11-9151","1.31159","38","Arranging Funeral Director | Assistant Manager of Operations | Computerized Forwarding System Supervisor | Distribution Operation Supervisor (SDO) | Distribution Operations Manager | Funeral Home Location Manager | Funeral Home Manager | Funeral Service Manager | Location Manager | Mail Delivery Supervisor | Market Manager | Mortuary Operations Manager | Postal Supervisor | Postmaster | Postmaster Relief (PMR) | Remote Encoding Center Manager | Remote Encoding Operations Supervisor | Sales Manager, Prearranged Funerals | Scheduling Manager"
"13-1011",".2222222",".2222222","0","8.143167","14.07905","-5.935887","Agents and Business Managers of Artists, Performers, and Athletes","13-1011","Business and Financial","14220","96310","Bachelors degree","business",".2381329","fine arts",".1483321","communications",".1003556","41-3011","1.932961","27-3031","1.925046","11-2011","1.721257","21","Agent | Artist Agent | Artist Manager | Artist Representative | Athlete Marketing Agent | Booking Agent | Talent Agent | Talent Buyer | Talent Manager | Theatrical Agent"
"13-1020",".1","0",".1","11.11111","0","11.11111","Wholesale and Retail Buyers, Except Farm Products","13-1022","Business and Financial","486900","75650","Bachelors degree","business",".425483","social sciences",".0785221","communications",".0532166","43-3061","2.123424","11-3061","1.932054","41-3031","1.840211","35",""
"13-1020","0","0","0","0","0","0","Buyers and Purchasing Agents, Farm Products","13-1021","Business and Financial","486900","75650","Bachelors degree","business",".425483","social sciences",".0785221","communications",".0532166","43-3061","2.123424","11-3061","1.932054","41-3031","1.840211","100",""
"13-1020",".1666667",".1111111",".0555556","11.64897","5.998085","5.65089","Purchasing Agents, Except Wholesale, Retail, and Farm Products","13-1023","Business and Financial","486900","75650","Bachelors degree","business",".425483","social sciences",".0785221","communications",".0532166","43-3061","2.123424","11-3061","1.932054","41-3031","1.840211","27",""
"13-1030","0","0","0","0","0","0","Claims Adjusters, Examiners, and Investigators","13-1031","Business and Financial","312810","76720","HS diploma or equivalent","business",".3313074","social sciences",".1019487","psychology",".060897","43-9041","2.028936","13-2053","1.533573","43-4041","1.526947","100",""
"13-1030","0","0","0","0","0","0","Insurance Appraisers, Auto Damage","13-1032","Business and Financial","312810","76720","HS diploma or equivalent","business",".3313074","social sciences",".1019487","psychology",".060897","43-9041","2.028936","13-2053","1.533573","43-4041","1.526947","100",""
"13-1041",".2323232",".239899","-.0075758","10.81971","13.17019","-2.350478","Compliance Officers","13-1041","Business and Financial","397770","78420","Bachelors degree","business",".2703725","social sciences",".1154491","biology and life sciences",".0699966","13-1111","1.59443","43-4061","1.443616","11-3012","1.423193","19",""
"13-1051",".1666667",".25","-.0833333","7.87037","17.12963","-9.259258","Cost Estimators","13-1051","Business and Financial","219530","77070","Bachelors degree","business",".2403375","engineering",".2036775","construction services",".0985867","11-9021","2.209282","43-5061","1.988457","17-3011","1.91887","27","Construction Estimator | Cost Analyst | Cost Estimator | Design Consultant | Estimator | Estimator Project Manager | Operations Manager | Project Manager | Sales Engineer"
"13-1070","0","0","0","0","0","0","Labor Relations Specialists","13-1075","Business and Financial","982460","72910","Bachelors degree","business",".379157","psychology",".0946395","social sciences",".088623","11-3121","2.275877","13-1141","2.144702","11-3111","1.914639","100",""
"13-1070","0","0","0","0","0","0","Farm Labor Contractors","13-1074","Business and Financial","982460","72910","Bachelors degree","business",".379157","psychology",".0946395","social sciences",".088623","11-3121","2.275877","13-1141","2.144702","11-3111","1.914639","100",""
"13-1070",".35",".25",".1","29.08473","12.09174","16.99298","Human Resources Specialists","13-1071","Business and Financial","982460","72910","Bachelors degree","business",".379157","psychology",".0946395","social sciences",".088623","11-3121","2.275877","13-1141","2.144702","11-3111","1.914639","11",""
"13-1081",".1240741",".087037",".037037","10.77167","5.960351","4.811323","Logisticians","13-1081","Business and Financial","235640","80880","Bachelors degree","business",".4145598","social sciences",".083775","engineering",".0545639","11-3071","2.777975","13-1082","2.456038","13-1111","2.227538","31","Integrated Logistics Support Manager (ILS Manager) | Logistician | Logistics Team Lead | Production Planner"
"13-1111",".3",".1",".2","23.63517","6.364829","17.27034","Management Analysts","13-1111","Business and Financial","893900","101190","Bachelors degree","business",".3017741","social sciences",".1236668","engineering",".1021647","13-1082","3.229924","11-3012","2.84692","11-3131","2.724947","14","Administrative Analyst | Business Analyst | Employment Programs Analyst | Management Analyst | Program Management Analyst | Quality Control Analyst"
"13-1121",".1538462",".2307692","-.0769231","8.811687","18.46104","-9.649351","Meeting, Convention, and Event Planners","13-1121","Business and Financial","134670","59440","Bachelors degree","business",".2891015","communications",".1588738","social sciences",".0815858","13-1111","1.812116","13-1131","1.720069","41-3091","1.706276","28","Catering Manager | Conference Manager | Conference Planner | Conference Planning Manager | Conference Services Manager | Convention Services Manager (CSM) | Director of Conference Services | Director of Events | Event Manager | Events Manager"
"13-1131",".0869565",".0869565","0","6.006048","7.327286","-1.321239","Fundraisers","13-1131","Business and Financial","105930","66490","Bachelors degree","business",".1722037","social sciences",".1571005","communications",".1269666","11-2030","2.73228","27-3031","1.982309","11-2011","1.758019","38","Development Director | Direct Response Consultant | Director of Development | Executive Director of Development and Alumni Relations | Executive Director of Development, Gift Planning | Fundraising Consultant | Principal Gifts Officer | Vice President for Philanthropy | Vice President of Major Gifts and Planned Giving | Vice President, Marketing & Development"
"13-1141","0","0","0","0","0","0","Compensation, Benefits, and Job Analysis Specialists","13-1141","Business and Financial","102370","77020","Bachelors degree","business",".4235398","social sciences",".0932422","psychology",".0761942","11-3111","3.36623","43-4161","2.575218","13-1111","2.490731","100","Benefits Administrator | Benefits Analyst | Benefits Manager | Benefits Specialist | Compensation / Benefits Specialist | Compensation Analyst | Human Resources Analyst | Human Resources Generalist | Human Resources Specialist (HR Specialist) | Personnel Specialist"
"13-1151",".1176471",".1176471","0","8.51513","5.770584","2.744546","Training and Development Specialists","13-1151","Business and Financial","436610","65850","Bachelors degree","business",".2318628","education administration and teaching",".0942607","social sciences",".0843899","11-3131","3.767212","13-1111","2.411986","25-9099","2.25741","32","Computer Training Specialist | Corporate Trainer | E-Learning Developer | Job Training Specialist | Management Development Specialist | Senior Instructor | Supervisory Training Specialist | Technical Trainer | Trainer | Training Specialist"
"13-1161",".5384616",".4615385",".0769231","34.05079","24.28255","9.768238","Market Research Analysts and Marketing Specialists","13-1161","Business and Financial","861140","76950","Bachelors degree","business",".3156519","communications",".1698872","social sciences",".0869688","11-2021","2.829391","11-2011","2.559391","41-3011","2.255764","5","Business Development Specialist | Client Service and Consulting Manager | Client Services Vice President | Communications Specialist | Market Analyst | Market Research Analyst | Market Research Consultant | Market Research Manager | Product Line Manager | Project Manager"
"13-1199",".153125",".1434888",".0096362","10.00624","9.41486",".5913796","Business Operations Specialists, All Other","13-1199","Business and Financial","1128200","81270","Bachelors degree","business",".2495598","social sciences",".1004001","engineering",".0790752","13-1111","2.071589","15-1212","1.732039","13-1082","1.631468","28",""
"13-2011",".4903846",".3269231",".1634615","35.99441","15.14195","20.85246","Accountants and Auditors","13-2011","Business and Financial","1448290","81680","Bachelors degree","business",".7207455","social sciences",".0476539","education administration and teaching",".0252165","13-2061","2.615612","13-2082","2.451367","43-3051","2.433681","7",""
